{
  "$schema": "https://json-schema.org/draft/2020-12/schema",
  "title": "history/YYYY/YYYY-MM.json",
  "description": "One calendar month: the account valuations, trades, bank lines, prices, FX rates and inflation-index values dated in it. A record's date decides its file (2026-09-30 goes in history/2026/2026-09.json). Records are sorted by date, then by ID. Keys: one valuation per account and date, one price per instrument and date, one FX rate per currency pair and date, one value per index and date; trades and bank lines are keyed by account, date and id. How an account's value and net worth are worked out from these records is in README.md, How values are computed; how a trades account's holdings, cost and cash follow from its trades is in TRADES.md.",
  "type": "object",
  "required": ["month", "valuations", "prices", "fx", "indices"],
  "properties": {
    "month": { "description": "The month, the same as the file name.", "$ref": "common.schema.json#/$defs/yearMonth" },
    "valuations": {
      "description": "Always written, even when empty.",
      "type": "array",
      "items": { "$ref": "#/$defs/valuation" }
    },
    "trades": {
      "description": "The trades of accounts with \"valuation\": \"trades\". Left out when empty.",
      "type": "array",
      "items": { "$ref": "#/$defs/trade" }
    },
    "lines": {
      "description": "The lines of cash, savings and tax-pot accounts' statements, kept so they can be checked and changed (IMPORT.md, Lines). Left out when empty.",
      "type": "array",
      "items": { "$ref": "#/$defs/bankLine" }
    },
    "prices": { "description": "Always written, even when empty.", "type": "array", "items": { "$ref": "#/$defs/price" } },
    "fx": { "description": "Always written, even when empty.", "type": "array", "items": { "$ref": "#/$defs/fx" } },
    "indices": { "description": "Always written, even when empty.", "type": "array", "items": { "$ref": "#/$defs/index" } }
  },
  "examples": [
    {
      "fx": [{ "base": "EUR", "date": "2026-09-30", "quote": "USD", "rate": "1.1712", "source": "ecb" }],
      "indices": [{ "date": "2026-09-30", "index": "hicp-it", "source": "eurostat", "value": "128.41" }],
      "lines": [
        { "account": "conto-fineco", "amount": "-200.6", "class": "transfer", "confirmed": true, "date": "2026-09-03", "id": "m2c7qk4a", "otherAccount": "directa", "source": "import", "text": "Bonifico a Directa SIM" },
        { "account": "conto-fineco", "amount": "-58.4", "class": "spending", "date": "2026-09-05", "id": "t6hw3bq2", "source": "import", "text": "Esselunga Milano" },
        { "account": "conto-fineco", "amount": "-58.4", "class": "spending", "date": "2026-09-05", "id": "zx5rnd7e", "note": "charged twice", "removed": true, "source": "import", "text": "Esselunga Milano" }
      ],
      "month": "2026-09",
      "prices": [
        { "currency": "EUR", "date": "2026-09-30", "instrument": "btc", "price": "95120", "source": "coingecko" },
        { "currency": "EUR", "date": "2026-09-30", "instrument": "gold", "price": "98.4", "source": "gold-api" },
        { "currency": "EUR", "date": "2026-09-30", "instrument": "vwce", "price": "138.42", "source": "yahoo" }
      ],
      "trades": [
        { "account": "directa", "amount": "200.6", "date": "2026-09-04", "id": "rkbyjhkx", "type": "deposit" },
        {
          "account": "directa",
          "date": "2026-09-12",
          "fees": "5",
          "id": "q4nkf6gi",
          "instrument": "vwce",
          "price": "134.75",
          "quantity": "10",
          "type": "buy"
        }
      ],
      "valuations": [
        { "account": "conto-deposito", "balance": "17365.55", "date": "2026-09-30", "interest": "35.05", "moneyIn": "0", "moneyOut": "0" },
        { "account": "conto-fineco", "balance": "4210.55", "date": "2026-09-30", "moneyIn": "3400", "moneyOut": "2560.2" },
        { "account": "directa", "cash": "312.1", "date": "2026-09-30" },
        { "account": "fondo-pensione", "balance": "18450.12", "date": "2026-09-30", "note": "from Q3 statement", "saved": "1325" },
        { "account": "gold-coins", "cash": "0", "date": "2026-09-30" }
      ]
    }
  ],
  "$defs": {
    "valuation": {
      "description": "What an account was worth on a date: a balance, or positions plus optional cash. Values carry forward until the account's next valuation. One with neither is worth zero; one with both counts its balance. An account that records trades records only cash: positions listed in its valuation are a check against its trades (TRADES.md), and a balance isn't used.",
      "type": "object",
      "required": ["account", "date"],
      "properties": {
        "account": { "$ref": "common.schema.json#/$defs/slug" },
        "date": { "$ref": "common.schema.json#/$defs/date" },
        "balance": {
          "description": "One amount in the account's currency, negative for debts.",
          "$ref": "common.schema.json#/$defs/decimal"
        },
        "cash": {
          "description": "Cash held next to the positions, in the account's currency.",
          "$ref": "common.schema.json#/$defs/decimal"
        },
        "positions": {
          "description": "Quantities held. Left out when empty.",
          "type": "array",
          "items": { "$ref": "#/$defs/position" }
        },
        "saved": {
          "description": "What was saved: the net money added (+) or taken out (−) since the account's previous valuation, in the account's currency. Their sum over a period is what you saved in it. Stored only for the kinds that ask for it, pension funds, TFR, property and other accounts recorded as a balance, where absent means unknown. What every other account saved is worked out from its records, and isn't written (ACCOUNTS.md): the whole change for cash accounts, debts and belongings, the change minus the interest for savings; an account that records trades gets it from its trades and cash.",
          "$ref": "common.schema.json#/$defs/decimal"
        },
        "moneyIn": {
          "description": "Money that arrived from outside your tracked accounts since the account's previous valuation (salary, refunds, gifts), in the account's currency, never negative. Money moved from another tracked account isn't counted. Absent means not recorded for the period; recorded together with moneyOut, as a valuation with only one of them isn't counted. Cash and savings accounts and tax pots record it at every value after their first (ACCOUNTS.md); other kinds don't. On a tax pot, money out is the tax paid from it and money in a refund of it.",
          "$ref": "common.schema.json#/$defs/decimal"
        },
        "moneyOut": {
          "description": "Money that left your tracked accounts since the account's previous valuation (spending, bills, rent, credit card, loan and mortgage payments), in the account's currency, never negative. Money moved to another tracked account isn't counted, unless it paid a debt. Absent means not recorded for the period; recorded together with moneyIn. Cash and savings accounts and tax pots record it at every value after their first (ACCOUNTS.md); other kinds don't. On a tax pot, money out is the tax paid from it and money in a refund of it.",
          "$ref": "common.schema.json#/$defs/decimal"
        },
        "oneOff": {
          "description": "Money that arrived from outside your tracked accounts since the account's previous valuation that is neither income nor paid back, such as an inheritance or the sale of something you didn't track, in the account's currency, never negative. Absent means none. It isn't in moneyIn; the savings rate leaves it out of what was saved, so it's neither came in nor spent (PROGRESS.md, \"Money in and out\"). Only cash and savings accounts record it, on a value with money in and out.",
          "$ref": "common.schema.json#/$defs/decimal"
        },
        "tax": {
          "description": "The part of moneyOut that was tax paid since the account's previous valuation, such as a yearly income tax bill paid from a current account, in the account's currency; negative for a refund, which lowers moneyOut. Absent means none. The savings rate takes it off what came in, so tax isn't spent (PROGRESS.md, \"Money in and out\"). Only cash and savings accounts record it, on a value with money in and out; a taxPot's tax is what moved into it.",
          "$ref": "common.schema.json#/$defs/decimal"
        },
        "interest": {
          "description": "The interest a savings account earned since its previous valuation, in the account's currency. Absent means none was recorded. What the value saved is the change minus it, so it counts as market, as a fund's return does. Only savings accounts record it.",
          "$ref": "common.schema.json#/$defs/decimal"
        },
        "note": { "type": "string" },
        "source": { "$ref": "common.schema.json#/$defs/dataSource" }
      }
    },
    "position": {
      "description": "A quantity of an instrument held in an account, valued at the latest price on or before the date.",
      "type": "object",
      "required": ["instrument", "quantity"],
      "properties": {
        "instrument": { "$ref": "common.schema.json#/$defs/slug" },
        "quantity": { "description": "In the instrument's unit.", "$ref": "common.schema.json#/$defs/decimal" },
        "costBasis": {
          "description": "The position's total purchase cost in the account's currency (valore di carico). Plans use it to estimate the tax on a sale; where it's missing, the plan's unrealizedGainShare estimate, or else the whole value counts as gain (with a warning).",
          "$ref": "common.schema.json#/$defs/decimal"
        }
      }
    },
    "trade": {
      "description": "A buy, a sell, a dividend or another event in an account that records trades (TRADES.md). Amounts are in the account's currency unless stated otherwise. Which fields a type uses, and its cash effect when amount is left out: buy and sell: instrument, quantity, price and/or amount; fees, tax, settlement (−(quantity × price + fees + tax) for a buy, quantity × price − fees − tax for a sale). dividend: amount, or quantity and the dividend per unit as price; instrument, tax, fees. interest: amount; tax. fee: amount or fees; settlement. tax: amount or tax (a tax charged on its own, e.g. imposta di bollo); settlement. deposit, withdrawal: amount. transferIn, opening: instrument, quantity, cost (no cash effect). transferOut: instrument, quantity. split: instrument, ratio. quantity × price is converted at the latest FX rate on or before the trade date, and computed amounts are rounded to cents.",
      "type": "object",
      "required": ["account", "date", "id", "type"],
      "properties": {
        "account": { "$ref": "common.schema.json#/$defs/slug" },
        "date": { "description": "The trade date.", "$ref": "common.schema.json#/$defs/date" },
        "id": {
          "description": "Unique among the account's trades on its date, stable across edits, so two identical trades on one day stay distinct and a trade edited on two devices merges as one. The app makes 8 random lowercase base32 characters; an imported trade gets a stable ID made from its row, so importing the file again finds it. Hand-written IDs can be any slug (buy-1).",
          "$ref": "common.schema.json#/$defs/slug"
        },
        "type": {
          "description": "What the trade does. transferIn and transferOut move securities between accounts or brokers; opening is a holding on the date the account's history starts.",
          "$comment": "Open enum: a type this version doesn't know is kept and pointed out; only its amount counts, in cash.",
          "enum": [
            "buy",
            "sell",
            "dividend",
            "interest",
            "fee",
            "tax",
            "deposit",
            "withdrawal",
            "transferIn",
            "transferOut",
            "split",
            "opening"
          ]
        },
        "instrument": {
          "description": "The instrument bought, sold, moved or split, or paying a dividend.",
          "$ref": "common.schema.json#/$defs/slug"
        },
        "quantity": {
          "description": "Units, always positive: the type says the direction.",
          "$ref": "common.schema.json#/$defs/decimal"
        },
        "bankLine": {
      "description": "One line of a cash, savings or tax-pot account's statement (IMPORT.md, Lines): a payment, a salary, money moved to another of your accounts. It keeps its own date, whatever check-ins the account has. What it is is the import's suggestion until confirmed. A removed line stays, so importing the statement again doesn't bring it back, but counts in nothing.",
      "type": "object",
      "required": ["account", "date", "id", "amount", "class"],
      "properties": {
        "account": { "$ref": "common.schema.json#/$defs/slug" },
        "date": { "description": "The day the bank booked it.", "$ref": "common.schema.json#/$defs/date" },
        "id": {
          "description": "Unique among the account's lines on its date. An imported line gets a stable ID made from its account, date, amount and text, and its position among the file's lines with all of these equal, so importing the file again finds it and keeps its changes. A line typed in gets 8 random lowercase base32 characters, as a trade does.",
          "$ref": "common.schema.json#/$defs/slug"
        },
        "amount": {
          "description": "Money in positive, money out negative, in the account's currency.",
          "$ref": "common.schema.json#/$defs/decimal"
        },
        "text": { "description": "The bank's text: its description and counterparty, as the file writes them. Left out when empty.", "type": "string" },
        "class": {
          "description": "What the line is. income: pay, a pension, rent. spending: money out, a credit card, loan or mortgage payment too; money in that is spending, such as a refund, lowers it. oneOff: an inheritance, a gift, the sale of something untracked. tax: tax paid; a refund lowers it. transfer: moved between your accounts, to or from otherAccount. interest: interest earned. ignore: not counted, still in the balance.",
          "$comment": "Open enum: a class this version doesn't know is kept and counted as ignore.",
          "enum": ["income", "spending", "oneOff", "tax", "transfer", "interest", "ignore"]
        },
        "otherAccount": {
          "description": "For a transfer: the account the money moved to or from, when known.",
          "$ref": "common.schema.json#/$defs/slug"
        },
        "note": { "type": "string" },
        "removed": { "description": "Removed, such as a duplicate: it counts in nothing. Written only when true.", "const": true },
        "confirmed": { "description": "What it is was confirmed; without it, it's the import's suggestion. Written only when true.", "const": true },
        "source": { "description": "import, or manual for a line typed in.", "$ref": "common.schema.json#/$defs/dataSource" }
      }
    },
    "price": { "description": "Per unit, in currency.", "$ref": "common.schema.json#/$defs/decimal" },
        "currency": {
          "description": "The price's currency. Default: the instrument's (the account's without an instrument).",
          "$ref": "common.schema.json#/$defs/currency"
        },
        "amount": {
          "description": "The cash effect on the account, in the account's currency, signed: negative for a buy, a fee, a tax or a withdrawal; positive for sale proceeds, dividends, interest and deposits. Net of fees and tax: what the cash actually changed by. Optional where it can be computed; when written, it wins. For a trade settled outside the account, what was paid or received there, signed the same way.",
          "$ref": "common.schema.json#/$defs/decimal"
        },
        "fees": {
          "description": "Commissions, positive. Part of amount, and of a buy's purchase cost.",
          "$ref": "common.schema.json#/$defs/decimal"
        },
        "tax": {
          "description": "Tax withheld, positive: on a sale's gain, a dividend or interest, or a transaction tax on a buy (part of its purchase cost). Part of amount.",
          "$ref": "common.schema.json#/$defs/decimal"
        },
        "cost": {
          "description": "The total purchase cost carried in, for transferIn and opening. Without it the cost is unknown.",
          "$ref": "common.schema.json#/$defs/decimal"
        },
        "ratio": {
          "description": "For split: new units per old unit, \"2\" for a 2-for-1 split, \"0.1\" for a 1-for-10 reverse split.",
          "$ref": "common.schema.json#/$defs/decimal"
        },
        "settlement": {
          "description": "For buy, sell, fee and tax: where it was paid from or into. account (the default, left out): the account's cash. external: outside the account, e.g. gold bought from a dealer and paid from the bank. Such a trade doesn't change the account's cash; its amount is money added (a buy, a fee, a tax) or taken out (a sale).",
          "$comment": "Open enum: a value this version doesn't know counts as account.",
          "enum": ["account", "external"]
        },
        "note": { "type": "string" },
        "source": { "$ref": "common.schema.json#/$defs/dataSource" }
      }
    },
    "price": {
      "description": "An instrument's price on a date, per its unit.",
      "type": "object",
      "required": ["instrument", "date", "price", "currency"],
      "properties": {
        "instrument": { "$ref": "common.schema.json#/$defs/slug" },
        "date": { "$ref": "common.schema.json#/$defs/date" },
        "price": { "$ref": "common.schema.json#/$defs/decimal" },
        "currency": { "description": "Normally the instrument's currency.", "$ref": "common.schema.json#/$defs/currency" },
        "source": { "$ref": "common.schema.json#/$defs/dataSource" }
      }
    },
    "fx": {
      "description": "An exchange rate on a date, in the ECB convention: 1 base = rate × quote.",
      "type": "object",
      "required": ["base", "quote", "date", "rate"],
      "properties": {
        "base": { "$ref": "common.schema.json#/$defs/currency" },
        "quote": { "$ref": "common.schema.json#/$defs/currency" },
        "date": { "$ref": "common.schema.json#/$defs/date" },
        "rate": { "$ref": "common.schema.json#/$defs/decimal" },
        "source": { "$ref": "common.schema.json#/$defs/dataSource" }
      }
    },
    "index": {
      "description": "A consumer-price-index value: a country's all-items HICP from Eurostat, 2015 = 100 (hicp-it, hicp-de, hicp-ch, …), or the euro area's (hicp-ea); the United States' CPI-U, all items, not seasonally adjusted, from the BLS, 1982–84 = 100 (cpi-us, series CUUR0000SA0); or the United Kingdom's CPI, all items, from the ONS, 2015 = 100 (cpi-gb, series D7BT). A monthly value is dated the last day of the month it measures and stored in that month's file, even when it's published later.",
      "type": "object",
      "required": ["index", "date", "value"],
      "properties": {
        "index": { "type": "string", "pattern": "^[a-z0-9-]+$" },
        "date": { "$ref": "common.schema.json#/$defs/date" },
        "value": { "$ref": "common.schema.json#/$defs/decimal" },
        "source": { "$ref": "common.schema.json#/$defs/dataSource" }
      }
    }
  }
}
