{
  "fx": [
    { "base": "EUR", "date": "2026-03-31", "quote": "USD", "rate": "1.1102", "source": "ecb" }
  ],
  "indices": [
    { "date": "2026-03-31", "index": "hicp-it", "source": "eurostat", "value": "126.95" }
  ],
  "month": "2026-03",
  "prices": [
    { "currency": "USD", "date": "2026-03-31", "instrument": "btc", "price": "88900", "source": "yahoo" },
    { "currency": "EUR", "date": "2026-03-31", "instrument": "gold", "price": "97.3", "source": "gold-api" },
    { "currency": "EUR", "date": "2026-03-31", "instrument": "vwce", "price": "127.85", "source": "yahoo" }
  ],
  "trades": [
    { "account": "directa", "amount": "1118.25", "date": "2026-03-04", "id": "qjmx4d5o", "type": "deposit" },
    {
      "account": "directa",
      "date": "2026-03-12",
      "fees": "5",
      "id": "ody4ieol",
      "instrument": "vwce",
      "price": "127.35",
      "quantity": "10",
      "type": "buy"
    },
    {
      "account": "gold-coins",
      "amount": "-3026.03",
      "currency": "EUR",
      "date": "2026-03-31",
      "id": "buy-gold",
      "instrument": "gold",
      "price": "97.3",
      "quantity": "31.1",
      "settlement": "external",
      "type": "buy"
    },
    {
      "account": "ledger-wallet",
      "currency": "USD",
      "date": "2026-03-31",
      "id": "buy-btc",
      "instrument": "btc",
      "price": "88900",
      "quantity": "0.03",
      "settlement": "external",
      "type": "buy"
    }
  ],
  "valuations": [
    { "account": "conto-deposito", "balance": "16159.5", "date": "2026-03-31", "interest": "32.55" },
    { "account": "conto-fineco", "balance": "5530.1", "date": "2026-03-31" },
    { "account": "directa", "cash": "150.2", "date": "2026-03-31" },
    { "account": "fondo-pensione", "balance": "17480.9", "date": "2026-03-31", "saved": "1325" },
    { "account": "gold-coins", "cash": "0", "date": "2026-03-31", "note": "bought a 1 oz coin" },
    { "account": "ledger-wallet", "cash": "0", "date": "2026-03-31" },
    { "account": "mutuo-casa", "balance": "-144950", "date": "2026-03-31" }
  ]
}
