{
  "fx": [
    { "base": "EUR", "date": "2026-07-31", "quote": "USD", "rate": "1.1256", "source": "ecb" }
  ],
  "indices": [
    { "date": "2026-07-31", "index": "hicp-it", "source": "eurostat", "value": "128.1" }
  ],
  "month": "2026-07",
  "prices": [
    { "currency": "USD", "date": "2026-07-31", "instrument": "btc", "price": "108900", "source": "yahoo" },
    { "currency": "EUR", "date": "2026-07-31", "instrument": "gold", "price": "100.4", "source": "gold-api" },
    { "currency": "EUR", "date": "2026-07-31", "instrument": "vwce", "price": "136.8", "source": "yahoo" }
  ],
  "trades": [
    {
      "account": "directa",
      "amount": "1162.8",
      "date": "2026-07-14",
      "fees": "5",
      "id": "27jvxijw",
      "instrument": "vwce",
      "price": "144.56",
      "quantity": "8.5",
      "tax": "60.95",
      "type": "sell"
    }
  ],
  "valuations": [
    {
      "account": "conto-deposito",
      "balance": "16795.55",
      "date": "2026-07-31",
      "interest": "34.9",
      "moneyIn": "0",
      "moneyOut": "0"
    },
    { "account": "conto-fineco", "balance": "3980.4", "date": "2026-07-31", "moneyIn": "3400", "moneyOut": "5010.55" },
    { "account": "directa", "cash": "1452.7", "date": "2026-07-31" },
    { "account": "mutuo-casa", "balance": "-142350", "date": "2026-07-31" }
  ]
}
