{
  "fx": [
    { "base": "EUR", "date": "2025-10-31", "quote": "USD", "rate": "1.0852", "source": "ecb" }
  ],
  "indices": [
    { "date": "2025-10-31", "index": "hicp-it", "source": "eurostat", "value": "126.1" }
  ],
  "month": "2025-10",
  "prices": [
    { "currency": "USD", "date": "2025-10-31", "instrument": "btc", "price": "98500", "source": "coingecko" },
    { "currency": "EUR", "date": "2025-10-31", "instrument": "gold", "price": "92.1", "source": "gold-api" },
    { "currency": "EUR", "date": "2025-10-31", "instrument": "vwce", "price": "128.1", "source": "yahoo" }
  ],
  "trades": [
    {
      "account": "directa",
      "cost": "38251.63",
      "date": "2025-10-31",
      "id": "puxzhjme",
      "instrument": "vwce",
      "note": "valore di carico from the statement",
      "quantity": "338",
      "source": "import",
      "type": "opening"
    },
    {
      "account": "gold-coins",
      "cost": "5210",
      "date": "2025-10-31",
      "id": "opening-gold",
      "instrument": "gold",
      "quantity": "62.2",
      "source": "import",
      "type": "opening"
    },
    {
      "account": "ledger-wallet",
      "cost": "38258.16",
      "date": "2025-10-31",
      "id": "opening-btc",
      "instrument": "btc",
      "quantity": "0.4215",
      "source": "import",
      "type": "opening"
    }
  ],
  "valuations": [
    { "account": "casa", "balance": "305000", "date": "2025-10-31", "source": "import" },
    { "account": "conto-deposito", "balance": "15000", "date": "2025-10-31", "source": "import" },
    { "account": "conto-fineco", "balance": "4820.3", "date": "2025-10-31", "source": "import" },
    { "account": "directa", "cash": "215.4", "date": "2025-10-31", "source": "import" },
    { "account": "fondo-pensione", "balance": "16120", "date": "2025-10-31", "source": "import" },
    { "account": "gold-coins", "cash": "0", "date": "2025-10-31", "source": "import" },
    { "account": "ledger-wallet", "cash": "0", "date": "2025-10-31", "source": "import" },
    { "account": "mutuo-casa", "balance": "-148200", "date": "2025-10-31", "source": "import" },
    { "account": "old-bank", "balance": "850", "date": "2025-10-31", "source": "import" },
    { "account": "tfr", "balance": "8100", "date": "2025-10-31", "source": "import" }
  ]
}
